Name,dov,Topic,Count,Representation,Representative_Docs
442_lenses_device_maude_sentinel,0.0040027869532865724,442,6,"['lenses', 'device', 'maude', 'sentinel', 'stroke', 'complications', 'cerebral', '30night', 'wear', 'pharmacy']","['All contact lenses (corrective/noncorrective) are considered Class II or Class III medical devices under the Federal Food, Drug, and Cosmetic Act, which also states that contact lenses can only be obtained with a prescription. The Forensic Chemistry Center of the US Food & Drug Administration has examined over 300 decorative, noncorrective contact lenses obtained without a prescription. Our observations indicate that 60% of the counterfeit lenses and 27% of the unapproved lenses examined were positive for microbial contamination. Twenty-nine different brands of noncorrective contact lenses were examined, and 48% of them had at least one sample positive for microbial contamination. Each microorganism was further identified using DNA sequencing. Contaminated contact lenses are associated with numerous health risks, including ocular infections and conjunctivitis leading to permanent visual impairment or blindness. These results support the contention that acquiring contact lenses without a prescription is a considerable threat to consumer health and safety.', 'The Sentinel Cerebral Protection System (Boston Scientific, Marlborough, Massachusetts) is indicated for use as a cerebral protection device to capture and remove embolic material during transcatheter aortic valve procedures and was approved by the US Food and Drug Administration (FDA) in 2017. Robust data on the most commonly reported complications and modes of failure associated with the Sentinel device are limited.\nWe analyzed postmarketing surveillance data from the FDA Manufacturer and User Facility Device Experience (MAUDE) database from 2017 through 2019, yielding 43 reports.\nOf the 43 reports of major complications involving Sentinel devices, 23 involved either death (3) or injury (20) related to the device. The 3 deaths were due to stroke, while 18 of the 20 injuries were reported as stroke. The other 20 reports were related to device modes of failure. Modes of failure were due to damaged device (5), difficulty retrieving/resheathing the device (5); package contamination (4), difficulty deploying the device (3), and, finally, complications with preparation (3).\nOur analysis of the MAUDE database demonstrates that in real-world practice, the Sentinel Cerebral Protection System may be associated with complications, including death, stroke, vascular injury, and difficulties with the device itself. The MAUDE database serves as an important tool for both physicians and manufacturers to optimize performance and clinical outcomes.', 'The Sentinel Cerebral Protection System (Boston Scientific, Marlborough, Massachusetts) is indicated for use as a cerebral protection device to capture and remove embolic material during transcatheter aortic valve procedures and was approved by the US Food and Drug Administration (FDA) in 2017. Robust data on the most commonly reported complications and modes of failure associated with the Sentinel device are limited.\nWe analyzed postmarketing surveillance data from the FDA Manufacturer and User Facility Device Experience (MAUDE) database from 2017 through 2019, yielding 43 reports.\nOf the 43 reports of major complications involving Sentinel devices, 23 involved either death (3) or injury (20) related to the device. The 3 deaths were due to stroke, while 18 of the 20 injuries were reported as stroke. The other 20 reports were related to device modes of failure. Modes of failure were due to damaged device (5), difficulty retrieving/resheathing the device (5); package contamination (4), difficulty deploying the device (3), and, finally, complications with preparation (3).\nOur analysis of the MAUDE database demonstrates that in real-world practice, the Sentinel Cerebral Protection System may be associated with complications, including death, stroke, vascular injury, and difficulties with the device itself. The MAUDE database serves as an important tool for both physicians and manufacturers to optimize performance and clinical outcomes.']"
453_sanguineus_sachet_salivary_am,0.005159504869210633,453,6,"['sanguineus', 'sachet', 'salivary', 'am', 'ivermectin', 'ram', 'glands', 'antiinsect', 'oo', 'oryzae']","['The purpose of this study was to develop an anti-insect pest repellent sachet to prevent Sitophilus oryzae (L.) (Coleoptera: Curculionidae) contamination in grain packaging. The anti-insect pest activities of essential oils (EOs) from garlic (Allium Sativum), ginger (Zingiber Officinalis), black pepper (Piper nigrum), onion (Allium cepa), and fennel (Foeniculum vulgare) as well as major compounds (allyl disulfide, AD; allyl mercaptan, AM) isolated from of garlic and onion (AD and AM) were measured against S. oryzae. The results revealed that garlic EO, onion EO, AD, and AM showed strong fumigant insecticidal activities. Among these, AM showed the highest acetylcholinesterase (AChE) inhibition rate, indicating that the fumigation insecticidal efficacy of AM is related with its AChE inhibition ability. Subsequently, the microcapsules were produced with a high efficiency (80.02%) by using AM as a core material and rice flour as a wall material. Finally, sachet composed of rice flour microcapsule containing 2% AM (RAM) was produced. Repellent assay was performed to measure anti-insect pest ability of the RAM sachet, showed remarkable repelling effect within 48 h both in the presence or absence of attractant. In a release profile of RAM sachet, it was expected to last over 20 mo during the distribution period of brown rice. Moreover, RAM sachet showed no undesirable changes to the sensory properties of the rice both before and after cooking. Taken together, these results suggest that the newly developed RAM sachet could be used as a packaging material to protect grain products from S. oryzae contamination.\nThe rice weevil, Sitophilus oryzae (L.) (Coleoptera: Curculionidae), causes damages to stored products and its contamination in grain products has become a major problem in cereal market. To preserve brown rice, an anti-insect pest repellent sachet containing 2% allyl mercaptan was newly developed and it showed remarkable repellent abilities against S. oryzae. It could be used as an active food packaging system to protect grain products from insect pest contamination.', ""The tick Rhipicephalus sanguineus sensu lato has great medical and veterinary importance, mainly because the ability to transmit many diseases, causing harm to pets but also risks to public health. The blood spoliation and transmission of pathogens occur because of the immunosuppressive action of these ticks' saliva, a potent mixture of bioactive substances that is secreted by the salivary glands, one of the organs responsible for their biological success, and hence the target of studies for their control. Ozone has promise for use as an alternative acaricide, due to its proven efficiency in controlling agricultural and food pests, besides posing no risk of environmental contamination or to animal and human health. Therefore, this study evaluated the acaricidal potential of exposure of females of R. sanguineus s.l. to ozonated water at many concentrations and analysed the morphophysiological alterations of the salivary glands, employing histological and light microscopic techniques. The results demonstrated that the ozonated water at the concentrations investigated caused severe alterations in the salivary glands, bringing a new perspective for control of R. sanguineus s.l., through an ecologically correct method due to the absence of harm to non-target organisms and the environment."", ""The tick Rhipicephalus sanguineus sensu lato has great medical and veterinary importance, mainly because the ability to transmit many diseases, causing harm to pets but also risks to public health. The blood spoliation and transmission of pathogens occur because of the immunosuppressive action of these ticks' saliva, a potent mixture of bioactive substances that is secreted by the salivary glands, one of the organs responsible for their biological success, and hence the target of studies for their control. Ozone has promise for use as an alternative acaricide, due to its proven efficiency in controlling agricultural and food pests, besides posing no risk of environmental contamination or to animal and human health. Therefore, this study evaluated the acaricidal potential of exposure of females of R. sanguineus s.l. to ozonated water at many concentrations and analysed the morphophysiological alterations of the salivary glands, employing histological and light microscopic techniques. The results demonstrated that the ozonated water at the concentrations investigated caused severe alterations in the salivary glands, bringing a new perspective for control of R. sanguineus s.l., through an ecologically correct method due to the absence of harm to non-target organisms and the environment.""]"
847_buttonwood_site_stem_cadmium,0.006593406593406591,847,3,"['buttonwood', 'site', 'stem', 'cadmium', 'leaf', 'chicory', 'endive', 'platanus', 'root', '633']","['Soil contaminated with cadmium presents a potential hazard for humans, animals and plants. The latter play a major role in the transfer of cadmium to the food chain. The uptake of cadmium and its accumulation by plants is dependent on various soil, plants and environmental factors. In order to identify soil properties with statistically significant influence on cadmium concentration in vegetables and to reduce the collection of data, time and costs, regression models can be applied. The main objective of this research was to develop regression models to predict the concentration of cadmium in 9-vegetable species: zucchini, tomato, cabbage, onion, potato, carrot, red beet, endive and chicory, based on soil properties. Soil samples were collected from 123 home gardens of the Municipality of Celje and 59 of these gardens were also included in vegetable sampling. The concentration of elements (e.g. arsenic, cadmium, copper, lead, and zinc) in the samples was determined by Inductively Coupled Plasma Mass Spectrometry. Single (for cabbage, potato, red beet and chicory) and multiple (for tomato, onion, carrot and endive) linear regression models were developed. There was no statistically significant regression model for zucchini. The most significant parameter for the influencing the cadmium concentration in vegetables was the concentration of cadmium in soil. Other important soil properties were the content of organic matter, pH-value and the concentration of manganese. It was concluded that consuming carrots, red beets, endives, onions, potatoes and chicory which are grown in gardens with Cd concentrations (mgkg(-1) DW) above 2.4, 3.2, 6.3, 7.9, 8.3 and 10.9, respectively, might represent an important contribution to dietary Cd exposure.', ""Toxicity and accumulation of cadmium in body organs by eating contaminated food has an important role in endangering a human's health. Using Environmental Protection Agency (EPA) reports, site 1, site 2 and site 3 were selected as polluted sites and site 4 was selected as the control site. Seedlings of buttonwood were prepared for 12 months then root, stem, and leaf samples were harvested and the amounts of cadmium element in stem and leaf organs together with the growth parameters were measured. This study determines the amount of cadmium accumulated in Platanus occidentalis. The respective cadmium concentrations in the root, leaf, and stem in site 1 were 382, 98, and 87; in site 2 they were 591, 122, and 94; and in site 3 they were 633, 151, and 104 mg/kg dry weight (DW). Furthermore, the comparison between accumulation and transfer of cadmium in the study showed more absorption of this metal by the root than that by the stem and leaf. The result of this research shows that buttonwood has the potential for cadmium accumulation without any serious damage to its growth. To control the extent of contamination in industrial areas, petrochemical industries, power plants and vast contaminated municipal areas, there is a great need for planting plants like buttonwood."", ""Toxicity and accumulation of cadmium in body organs by eating contaminated food has an important role in endangering a human's health. Using Environmental Protection Agency (EPA) reports, site 1, site 2 and site 3 were selected as polluted sites and site 4 was selected as the control site. Seedlings of buttonwood were prepared for 12 months then root, stem, and leaf samples were harvested and the amounts of cadmium element in stem and leaf organs together with the growth parameters were measured. This study determines the amount of cadmium accumulated in Platanus occidentalis. The respective cadmium concentrations in the root, leaf, and stem in site 1 were 382, 98, and 87; in site 2 they were 591, 122, and 94; and in site 3 they were 633, 151, and 104 mg/kg dry weight (DW). Furthermore, the comparison between accumulation and transfer of cadmium in the study showed more absorption of this metal by the root than that by the stem and leaf. The result of this research shows that buttonwood has the potential for cadmium accumulation without any serious damage to its growth. To control the extent of contamination in industrial areas, petrochemical industries, power plants and vast contaminated municipal areas, there is a great need for planting plants like buttonwood.""]"
690_sfr_bottles_asepticuht_1011,0.004046105051977332,690,4,"['sfr', 'bottles', 'asepticuht', '1011', 'stearothermophilus', 'aseptic', 'recontamination', 'process', 'mold', 'modules']","['Aseptic ultra-high-temperature (UHT)-type processed food products (e.g., milk or soup) are ready to eat products which are consumed extensively globally due to a combination of their comparative high quality and long shelf life, with no cold chain or other preservation requirements. Due to the inherent microbial vulnerability of aseptic-UHT product formulations, the safety and stability-related performance objectives (POs) required at the end of the manufacturing process are the most demanding found in the food industry. The key determinants to achieving sterility, and which also differentiates aseptic-UHT from in-pack sterilised products, are the challenges associated with the processes of aseptic filling and sealing. This is a complex process that has traditionally been run using deterministic or empirical process settings. Quantifying the risk of microbial contamination and recontamination along the aseptic-UHT process, using the scientifically based process quantitative microbial risk assessment (QMRA), offers the possibility to improve on the currently tolerable sterility failure rate (i.e., 1 defect per 10,000 units). In addition, benefits of applying QMRA are (i) to implement process settings in a transparent and scientific manner; (ii) to develop a uniform common structure whatever the production line, leading to a harmonisation of these process settings, and; (iii) to bring elements of a cost-benefit analysis of the management measures. The objective of this article is to explore how QMRA techniques and risk management metrics may be applied to aseptic-UHT-type processed food products. In particular, the aseptic-UHT process should benefit from a number of novel mathematical and statistical concepts that have been developed in the field of QMRA. Probabilistic techniques such as Monte Carlo simulation, Bayesian inference and sensitivity analysis, should help in assessing the compliance with safety and stability-related POs set at the end of the manufacturing process. The understanding of aseptic-UHT process contamination will be extended beyond the current ""as-low-as-reasonably-achievable"" targets to a risk-based framework, through which current sterility performance and future process designs can be optimised.', 'Aseptic-Ultra-High-Temperature (UHT) products are manufactured to be free of microorganisms capable of growing in the food at normal non-refrigerated conditions at which the food is likely to be held during manufacture, distribution and storage. Two important phases within the process are widely recognised as critical in controlling microbial contamination: the sterilisation steps and the following aseptic steps. Of the microbial hazards, the pathogen spore formers Clostridium botulinum and Bacillus cereus are deemed the most pertinent to be controlled. In addition, due to a relatively high thermal resistance, Geobacillus stearothermophilus spores are considered a concern for spoilage of low acid aseptic-UHT products. A probabilistic exposure assessment model has been developed in order to assess the aseptic-UHT product failure rate associated with these three bacteria. It was a Modular Process Risk Model, based on nine modules. They described: i) the microbial contamination introduced by the raw materials, either from the product (i.e. milk, cocoa and dextrose powders and water) or the packaging (i.e. bottle and sealing component), ii) the sterilisation processes, of either the product or the packaging material, iii) the possible recontamination during subsequent processing of both product and packaging. The Sterility Failure Rate (SFR) was defined as the sum of bottles contaminated for each batch, divided by the total number of bottles produced per process line run (10(6) batches simulated per process line). The SFR associated with the three bacteria was estimated at the last step of the process (i.e. after Module 9) but also after each module, allowing for the identification of modules, and responsible contamination pathways, with higher or lower intermediate SFR. The model contained 42 controlled settings associated with factory environment, process line or product formulation, and more than 55 probabilistic inputs corresponding to inputs with variability conditional to a mean uncertainty. It was developed in @Risk and run through Monte Carlo simulations. Overall, the highest SFR was associated with G. stearothermophilus (380000 bottles contaminated in 10(11) bottles produced) and the lowest to C. botulinum (3 bottles contaminated in 10(11) bottles produced). Unsurprisingly, SFR due to G. stearothermophilus was due to its ability to survive the UHT treatment. More interestingly, it was identified that SFR due to B. cereus (17000 bottles contaminated in 10(11) bottles produced) was due to an airborne recontamination of the aseptic tank (49%) and a post-sterilisation packaging contamination (33%). A deeper analysis (sensitivity and scenario analyses) was done to investigate how the SFR due to B. cereus could be reduced by changing the process settings related to potential air recontamination source.', 'Aseptic-Ultra-High-Temperature (UHT) products are manufactured to be free of microorganisms capable of growing in the food at normal non-refrigerated conditions at which the food is likely to be held during manufacture, distribution and storage. Two important phases within the process are widely recognised as critical in controlling microbial contamination: the sterilisation steps and the following aseptic steps. Of the microbial hazards, the pathogen spore formers Clostridium botulinum and Bacillus cereus are deemed the most pertinent to be controlled. In addition, due to a relatively high thermal resistance, Geobacillus stearothermophilus spores are considered a concern for spoilage of low acid aseptic-UHT products. A probabilistic exposure assessment model has been developed in order to assess the aseptic-UHT product failure rate associated with these three bacteria. It was a Modular Process Risk Model, based on nine modules. They described: i) the microbial contamination introduced by the raw materials, either from the product (i.e. milk, cocoa and dextrose powders and water) or the packaging (i.e. bottle and sealing component), ii) the sterilisation processes, of either the product or the packaging material, iii) the possible recontamination during subsequent processing of both product and packaging. The Sterility Failure Rate (SFR) was defined as the sum of bottles contaminated for each batch, divided by the total number of bottles produced per process line run (10(6) batches simulated per process line). The SFR associated with the three bacteria was estimated at the last step of the process (i.e. after Module 9) but also after each module, allowing for the identification of modules, and responsible contamination pathways, with higher or lower intermediate SFR. The model contained 42 controlled settings associated with factory environment, process line or product formulation, and more than 55 probabilistic inputs corresponding to inputs with variability conditional to a mean uncertainty. It was developed in @Risk and run through Monte Carlo simulations. Overall, the highest SFR was associated with G. stearothermophilus (380000 bottles contaminated in 10(11) bottles produced) and the lowest to C. botulinum (3 bottles contaminated in 10(11) bottles produced). Unsurprisingly, SFR due to G. stearothermophilus was due to its ability to survive the UHT treatment. More interestingly, it was identified that SFR due to B. cereus (17000 bottles contaminated in 10(11) bottles produced) was due to an airborne recontamination of the aseptic tank (49%) and a post-sterilisation packaging contamination (33%). A deeper analysis (sensitivity and scenario analyses) was done to investigate how the SFR due to B. cereus could be reduced by changing the process settings related to potential air recontamination source.']"
