Name,dov,Topic,Count,Representation,Representative_Docs
656_timetemperature_git_options_simulated,0.005064865550604929,656,4,"['timetemperature', 'git', 'options', 'simulated', 'buffering', 'metrics', 'orientating', 'primocontamination', 'prioritarily', 'whatif']","['Even though a plethora of barriers are employed by the human gastrointestinal tract (GIT) to cope with invading pathogens, foodborne diseases are still a common problem. The survival of food pathogens in the GIT is known to depend on food carrier properties. The aim of this study was to investigate the influence of food buffering capacity and food structure on the survival of Salmonella Typhimurium and Listeria monocytogenes during simulated digestion, following contamination of different food model systems that had different combinations of fat and protein content. The results illustrated the strong protective properties of proteins, acting either as a strong buffering agent or as a physical barrier against gastric acidity, for both pathogens. In comparison, fat manifested a lower buffering capacity and weaker protective effects against the two pathogens. Intriguingly, a low fat content was often linked with increased microbial resistance. Nonetheless, both pathogens survived their transit through the simulated GIT in all cases, with S. Typhimurium exhibiting growth during intestinal digestion and L.monocytogenes demonstrating a healthy residual population at the end of the intestinal phase. These results corroborate the need for a deeper understanding regarding the mechanisms with which food affects bacterial survival in the human GIT.', 'According to Codex Alimentarius Commission recommendations, management options applied at the process production level should be based on good hygiene practices, HACCP system, and new risk management metrics such as the food safety objective. To follow this last recommendation, the use of quantitative microbiological risk assessment is an appealing approach to link new risk-based metrics to management options that may be applied by food operators. Through a specific case study, Listeria monocytogenes in soft cheese made from pasteurized milk, the objective of the present article is to practically show how quantitative risk assessment could be used to direct potential intervention strategies at different food processing steps. Based on many assumptions, the model developed estimates the risk of listeriosis at the moment of consumption taking into account the entire manufacturing process and potential sources of contamination. From pasteurization to consumption, the amplification of a primo-contamination event of the milk, the fresh cheese or the process environment is simulated, over time, space, and between products, accounting for the impact of management options, such as hygienic operations and sampling plans. A sensitivity analysis of the model will help orientating data to be collected prioritarily for the improvement and the validation of the model. What-if scenarios were simulated and allowed for the identification of major parameters contributing to the risk of listeriosis and the optimization of preventive and corrective measures.', 'According to Codex Alimentarius Commission recommendations, management options applied at the process production level should be based on good hygiene practices, HACCP system, and new risk management metrics such as the food safety objective. To follow this last recommendation, the use of quantitative microbiological risk assessment is an appealing approach to link new risk-based metrics to management options that may be applied by food operators. Through a specific case study, Listeria monocytogenes in soft cheese made from pasteurized milk, the objective of the present article is to practically show how quantitative risk assessment could be used to direct potential intervention strategies at different food processing steps. Based on many assumptions, the model developed estimates the risk of listeriosis at the moment of consumption taking into account the entire manufacturing process and potential sources of contamination. From pasteurization to consumption, the amplification of a primo-contamination event of the milk, the fresh cheese or the process environment is simulated, over time, space, and between products, accounting for the impact of management options, such as hygienic operations and sampling plans. A sensitivity analysis of the model will help orientating data to be collected prioritarily for the improvement and the validation of the model. What-if scenarios were simulated and allowed for the identification of major parameters contributing to the risk of listeriosis and the optimization of preventive and corrective measures.']"
749_fluorescence_urine_hai_microfiber,0.004123680315156548,749,4,"['fluorescence', 'urine', 'hai', 'microfiber', 'masking', 'cloth', 'ward', 'hydrogen', 'fluorescencebased', 'headspace']","['A novel straightforward analytical technique was developed to monitor the emission of hydrogen from anaerobic bacteria cultured in sealed headspace vials using a specific hydrogen sensor. The results were compared with headspace gas chromatography carried out in parallel. This technique was also applied to investigate the efficacy of chemical antibiotics and of natural compounds with antimicrobial properties. Antibiotics added to the sample cultures are apparently effective if the emission of hydrogen is suppressed, or if not, are either ineffective or the related bacteria are even resistant. The sensor approach was applied to prove bacterial contamination in food, animals, medical specimens and in ticks infected by ', 'Hygiene hypothesis and sanitization are two important pivots of modern civilization. The drinking water should be free from urine and stool contamination. Coliform test is popular for understanding feces contamination. However, understanding urine contamination in drinking water is a difficult task. On the other hand, urine contamination can cause disease like leptospirosis. It occurs mainly in animals and infects humans through contaminated water, food, and soil and causes serious consequences. Rat urine is the most common source of such disease outbreaks. Further, sophisticated laboratories with high-end technologies may not be present at the site of disease outbreaks. In this context, we have proposed a spectrofluorimetric approach to screen urine contamination in water. The screening method can sense up to 156 nl/ml of rat urine.', 'Healthcare-associated infections (HCAI/HAI) represent a substantial threat to patient health during hospitalization and incur billions of dollars additional cost for subsequent treatment. One promising method for the detection of bacterial contamination in a clinical setting before an HAI outbreak occurs is to exploit native fluorescence of cellular molecules for a hand-held, rapid-sweep surveillance instrument. Previous studies have shown fluorescence-based detection to be sensitive and effective for food-borne and environmental microorganisms, and even to be able to distinguish between cell types, but this powerful technique has not yet been deployed on the macroscale for the primary surveillance of contamination in healthcare facilities to prevent HAI. Here we report experimental data for the specification and design of such a fluorescence-based detection instrument. We have characterized the complete fluorescence response of eleven clinically-relevant bacteria by generating excitation-emission matrices (EEMs) over broad wavelength ranges. Furthermore, a number of surfaces and items of equipment commonly present on a ward, and potentially responsible for pathogen transfer, have been analyzed for potential issues of background fluorescence masking the signal from contaminant bacteria. These include bedside handrails, nurse call button, blood pressure cuff and ward computer keyboard, as well as disinfectant cleaning products and microfiber cloth. All examined bacterial strains exhibited a distinctive double-peak fluorescence feature associated with tryptophan with no other cellular fluorophore detected. Thus, this fluorescence survey found that an emission peak of 340nm, from an excitation source at 280nm, was the cellular fluorescence signal to target for detection of bacterial contamination. The majority of materials analysed offer a spectral window through which bacterial contamination could indeed be detected. A few instances were found of potential problems of background fluorescence masking that of bacteria, but in the case of the microfiber cleaning cloth, imaging techniques could morphologically distinguish between stray strands and bacterial contamination.']"
548_house_flies_mandibular_microbe,0.004207751591014205,548,5,"['house', 'flies', 'mandibular', 'microbe', 'glands', 'caterpillars', 'volatiles', 'labial', 'immune', 'insect']","['Insect pests cause serious economic, yield, and food safety problems to managed crops worldwide. Compounding these problems, insect pests often vector pathogenic or toxigenic microbes to plants. Previous work has considered plant-insect and plant-microbe interactions separately. Although insects are well-understood to use plant volatiles to locate hosts, microorganisms can produce distinct and abundant volatile compounds that in some cases strongly attract insects. In this paper, we focus on the microbial contribution to plant volatile blends, highlighting the compounds emitted and the potential for variation in microbial emission. We suggest that these aspects of microbial volatile emission may make these compounds ideal for use in agricultural applications, as they may be more specific or enhance methods currently used in insect control or monitoring. Our survey of microbial volatiles in insect-plant interactions suggests that these emissions not only signal host suitability but may indicate a distinctive time frame for optimal conditions for both insect and microbe. Exploitation of these host-specific microbe semiochemicals may provide important microbe- and host-based attractants and a basis for future plant-insect-microbe chemical ecology investigations.', 'More than half of the proteome from mandibular glands in caterpillars is represented by chemosensory proteins. Based on sequence similarity, these proteins are putative transporters of ligands to gustatory receptors in sensory organs of insects. We sought to determine whether these proteins are inducible by comparing, both qualitatively and quantitatively, the salivary (mandibular and labial) proteomes from caterpillars (Vanessa cardui) reared on different plants and artificial diet containing either bacteria or bacterial cell-walls. We included a treatment where the caterpillars were switched from feeding on artificial diet to plant material at some point in their development. Additionally, we evaluated the degree of overlap between the proteomes in the hemolymph-filled coelom and salivary glands of caterpillars reared on plant material. We found that the quality and quantity of the identified proteins differed clearly between hemolymph-filled coelome, labial and mandibular glands. Our results indicated that even after molting and two-day feeding on a new diet, protein production is affected by the previous food source used by the caterpillar. Candidate proteins involved in chemosensory perception by insects were detected: three chemosensory (CSPs) and two odorant-binding proteins (OBPs). Using the relative amounts of these proteins across tissues and treatments as criteria for their classification, we detected hemolymph- and mandibular gland-specific CSPs and observed that their levels were affected by caterpillar diet. Moreover, we could compare the protein and transcript levels across tissues and treatment for at least one CSP and one OBP. Therefore, we have identified specific isoforms for testing the role of CSPs and OBPs in plant and pathogen recognition. We detected catalase, immune-related protein and serine proteases and their inhibitors in high relative levels in the mandibular glands in comparison to the labial glands. These findings suggest that the mandibular glands of caterpillars may play an important role protecting the caterpillar from oxidative stress, pathogens and aiding in digestion. Contamination with hemolymph proteins during dissection of salivary glands from caterpillars may occur but it is not substantial since the proteomes from hemolymph, mandibular and labial glands were easily discriminated from each other by principal component analysis of proteomic data.', 'House flies are of major concern as vectors of food-borne pathogens to food crops. House flies are common pests on cattle feedlots and dairies, where they develop in and feed on animal waste. By contacting animal waste, house flies can acquire human pathogenic bacteria such as Escherichia coli and Salmonella spp., in addition to other bacteria, viruses, or parasites that may infect humans and animals. The subsequent dispersal of house flies from animal facilities to nearby agricultural fields containing food crops may lead to pre-harvest food contamination with these pathogens. We hypothesized that odors from honeydew, the sugary excreta produced by sucking insects feeding on crops, or molds and fungi growing on honeydew, may attract house flies, thereby increasing the risk of food crop contamination. House fly attraction to honeydew-contaminated plant material was evaluated using a laboratory bioassay. House flies were attracted to the following plant-pest-honeydew combinations: citrus mealybug on squash fruit, pea aphid on faba bean plants, whitefly on navel orange and grapefruit leaves, and combined citrus mealybug and cottony cushion scale on mandarin orange leaves. House flies were not attracted to field-collected samples of lerp psyllids on eucalyptus plants or aphids on crepe myrtle leaves. Fungi associated with field-collected honeydews were isolated and identified for further study as possible emitters of volatiles attractive to house flies. Two fungal species, Aureobasidium pullulans and Cladosporium cladosporioides, were repeatedly isolated from field-collected honeydew samples. Both fungal species were grown in potato dextrose enrichment broth and house fly attraction to volatiles from these fungal cultures was evaluated. House flies were attracted to odors from A. pullulans cultures but not to those of C. cladosporioides. Identification of specific honeydew odors that are attractive to house flies could be valuable for the development of improved house fly baits for management of this pest species.']"
633_iso_166542001_cen_en,0.006024096385542172,633,4,"['iso', '166542001', 'cen', 'en', 'mandate', 'validation', 'm381', 'interlaboratory', 'sprouts', 'participating']","['The European and International Standard method for the detection of Salmonella spp. in samples from the primary production stage, EN ISO 6579:2002/Amd.1:2007, was validated by an interlaboratory study in the frame of Mandate M/381, ordered by the European Commission and accepted by the European Standardisation Organisation (CEN). In addition to this study, results from two interlaboratory studies organised earlier by the European Union Reference Laboratory (EURL) for Salmonella were used for determination of the performance characteristics. Parallel to the performance evaluation for the Mandate, the revision of EN ISO 6579:2002 started. Part of this revision was the incorporation of the standardised method for detection of Salmonella in samples from the primary production stage (EN ISO 6579:2002/Amd.1:2007) and its performance characteristics in the new part 1 of EN ISO 6579. The 2002 version of EN ISO 6579 already contained performance characteristics for the detection of Salmonella in food samples, but LOD', 'In 2006, the European Committee for standardisation (CEN)/Technical Committee 275 - Food analysis - Horizontal methods/Working Group 6 - Microbiology of the food chain (TC275/WG6), launched the project of validating the method ISO 16654:2001 for the detection of Escherichia coli O157 in foodstuff by the evaluation of its performance, in terms of sensitivity and specificity, through collaborative studies. Previously, a validation study had been conducted to assess the performance of the Method No 164 developed by the Nordic Committee for Food Analysis (NMKL), which aims at detecting E. coli O157 in food as well, and is based on a procedure equivalent to that of the ISO 16654:2001 standard. Therefore, CEN established that the validation data obtained for the NMKL Method 164 could be exploited for the ISO 16654:2001 validation project, integrated with new data obtained through two additional interlaboratory studies on milk and sprouts, run in the framework of the CEN mandate No. M381. The ISO 16654:2001 validation project was led by the European Union Reference Laboratory for Escherichia coli including VTEC (EURL-VTEC), which organized the collaborative validation study on milk in 2012 with 15 participating laboratories and that on sprouts in 2014, with 14 participating laboratories. In both studies, a total of 24 samples were tested by each laboratory. Test materials were spiked with different concentration of E. coli O157 and the 24 samples corresponded to eight replicates of three levels of contamination: zero, low and high spiking level. The results submitted by the participating laboratories were analyzed to evaluate the sensitivity and specificity of the ISO 16654:2001 method when applied to milk and sprouts. The performance characteristics calculated on the data of the collaborative validation studies run under the CEN mandate No. M381 returned sensitivity and specificity of 100% and 94.4%, respectively for the milk study. As for sprouts matrix, the sensitivity resulted in 75.9% in the low level of contamination samples and 96.4% in samples spiked with high level of E. coli O157 and specificity was calculated as 99.1%.', 'In 2006, the European Committee for standardisation (CEN)/Technical Committee 275 - Food analysis - Horizontal methods/Working Group 6 - Microbiology of the food chain (TC275/WG6), launched the project of validating the method ISO 16654:2001 for the detection of Escherichia coli O157 in foodstuff by the evaluation of its performance, in terms of sensitivity and specificity, through collaborative studies. Previously, a validation study had been conducted to assess the performance of the Method No 164 developed by the Nordic Committee for Food Analysis (NMKL), which aims at detecting E. coli O157 in food as well, and is based on a procedure equivalent to that of the ISO 16654:2001 standard. Therefore, CEN established that the validation data obtained for the NMKL Method 164 could be exploited for the ISO 16654:2001 validation project, integrated with new data obtained through two additional interlaboratory studies on milk and sprouts, run in the framework of the CEN mandate No. M381. The ISO 16654:2001 validation project was led by the European Union Reference Laboratory for Escherichia coli including VTEC (EURL-VTEC), which organized the collaborative validation study on milk in 2012 with 15 participating laboratories and that on sprouts in 2014, with 14 participating laboratories. In both studies, a total of 24 samples were tested by each laboratory. Test materials were spiked with different concentration of E. coli O157 and the 24 samples corresponded to eight replicates of three levels of contamination: zero, low and high spiking level. The results submitted by the participating laboratories were analyzed to evaluate the sensitivity and specificity of the ISO 16654:2001 method when applied to milk and sprouts. The performance characteristics calculated on the data of the collaborative validation studies run under the CEN mandate No. M381 returned sensitivity and specificity of 100% and 94.4%, respectively for the milk study. As for sprouts matrix, the sensitivity resulted in 75.9% in the low level of contamination samples and 96.4% in samples spiked with high level of E. coli O157 and specificity was calculated as 99.1%.']"
829_fnu_racks_boards_cutting,0.0045180722891566254,829,3,"['fnu', 'racks', 'boards', 'cutting', 'hygienic', 'construction', 'sanitary', 'adhesion', 'equipment', 'refrigerators']","['Providing safe food products to the consumer depends on the material and technology used and adherence to hygienic practices, throughout the production process. The degree of microbial contamination of a surface is an important indicator of equipment cleanliness and effectiveness of cleaning and disinfection. Used material, construction solutions and quality of the applied devices also have an effect on hygienic status.\nThe objective of the present study was to evaluate the influence of the design and construction material of selected food storage racks, available on the Polish market, on their hygienic status.\nThe study was based on determination of the capability of microbial growth on the surface of the racks and the effectiveness of their cleaning. Microbiological cleanliness on the surface of the racks was monitored by the contact plates which are able to estimate the total number of icroorganisms. Examination of effectiveness of cleaning was conducted by the use of ATP bioluminescence method.\nThis experiment has proven a significant influence of adopted construction solutions on the hygienic status of the examined racks. Presence of antibacterial layer and a choice of the appropriate construction material characterized by a low surface roughness impedes the microbial growth and increases the effectiveness of cleaning.\nDesign solutions have significant impact on the hygienic status of shelves. Selection of a suitable material for the construction of racks can greatly reduce the possibility of the development of microorganism, despite the low efficiency of the cleaning. The application of antimicrobial coatings inhibits microbial growth.', 'The hygienic and sanitary control in Food and Nutrition Units (FNU) is considered a standard procedure to produce adequate meals and reduce the risk of foodborne diseases and hospital infections. This study aimed to evaluate the isolation and identification of bacteria from equipment and food contact surfaces in a hospital FNU as well as to evaluate the sanitary condition. Likewise, it was analyzed the adhesion of the microorganisms on polyethylene cutting boards. The presence of aerobic mesophilic microorganisms, yeasts, molds, coagulase-positive staphylococci, coliform and fecal coliform, and Escherichia coli were analyzed on eating tables, countertop surfaces and cutting boards used for meat or vegetable handling, and equipment such as microwaves and refrigerators. The molecular identification it was done by 16S rRNA gene sequencing. The adhesion of the microorganisms (biofilm formation) on meat and vegetable cutting boards was also evaluated by scanning electron microscopy. The results showed high numbers of all microorganisms, except for E. coli , which was not observed in the samples. The molecular analysis identified species of the Enterobacteriaceae family and species of the Pseudomonadaceae family. Scanning electron microscopy analyses revealed bacterial adhesion on the cutting board surfaces. The results obtained in this study indicated that the hygienic conditions of surfaces like plastic cutting boards and equipment in this hospital FNU were inadequate. The achievement and application of standard operating procedures could positively help in the standardization of sanitary control, reducing the microbial contamination and providing a safe food to hospitalized patients.', 'The hygienic and sanitary control in Food and Nutrition Units (FNU) is considered a standard procedure to produce adequate meals and reduce the risk of foodborne diseases and hospital infections. This study aimed to evaluate the isolation and identification of bacteria from equipment and food contact surfaces in a hospital FNU as well as to evaluate the sanitary condition. Likewise, it was analyzed the adhesion of the microorganisms on polyethylene cutting boards. The presence of aerobic mesophilic microorganisms, yeasts, molds, coagulase-positive staphylococci, coliform and fecal coliform, and Escherichia coli were analyzed on eating tables, countertop surfaces and cutting boards used for meat or vegetable handling, and equipment such as microwaves and refrigerators. The molecular identification it was done by 16S rRNA gene sequencing. The adhesion of the microorganisms (biofilm formation) on meat and vegetable cutting boards was also evaluated by scanning electron microscopy. The results showed high numbers of all microorganisms, except for E. coli , which was not observed in the samples. The molecular analysis identified species of the Enterobacteriaceae family and species of the Pseudomonadaceae family. Scanning electron microscopy analyses revealed bacterial adhesion on the cutting board surfaces. The results obtained in this study indicated that the hygienic conditions of surfaces like plastic cutting boards and equipment in this hospital FNU were inadequate. The achievement and application of standard operating procedures could positively help in the standardization of sanitary control, reducing the microbial contamination and providing a safe food to hospitalized patients.']"
