Name,dov,Topic,Count,Representation,Representative_Docs
582_foragers_social_collective_colony,0.0042690673085096645,582,5,"['foragers', 'social', 'collective', 'colony', 'nestmates', 'flower', 'foraging', 'bees', 'immunity', 'adjust']","[""Foraging is a result of innate and acquired mechanisms, and is optimized in order to increase fitness. During foraging, an animal faces many threats, such as predation and infection. The uptake of parasites and diseases while foraging is common and an individual should be adapted to detect and avoid such threats, using cues from either the abiotic environment or the parasite. Social animals possess an additional cue to detect such contaminated food sources: information provided by conspecifics. Bumblebees avoid contaminated flowers, but the cues used by the bees to distinguish contamination remain unknown. Under controlled laboratory conditions, we tested the use of scent marks derived from other foragers in choosing between a contaminated (by Crithidia bombi) and an uncontaminated flower. As a positive control we tested the bee's choice between two flowers, one scented with geraniol and containing a highly rewarding sugar solution, and the other not scented and containing a poorer reward. The bees mainly chose the uncontaminated and the rewarding scented flowers. Scent marks did not increase the efficiency of the bumblebees in choosing the better flower. The bees from both experiments behaved similarly, showing that the main and most relevant cue used to choose the uncontaminated flower is the odour from the parasite itself. The adaptation of bumblebees to avoid flowers contaminated by C. bombi arose from the long-term host-parasite interaction between these species. This strong adaptation results in an innate behaviour of bees and a detection and aversion of the odour of contaminated flower nectar."", 'Animals often alter their food choices following a pathogen infection in order to increase immune function and combat the infection. Whether social animals that collect food for their brood or nestmates adjust their nutrient intake to the infection states of their social partners is virtually unexplored. Here we develop an individual-based model of nutritional geometry to examine the impact of collective nutrient balancing on pathogen spread in a social insect colony. The model simulates a hypothetical social insect colony infected by a horizontally transmitted parasite. Simulation experiments suggest that collective nutrition, by which foragers adjust their nutrient intake to simultaneously address their own nutritional needs as well as those of their infected nestmates, is an efficient social immunity mechanism to limit contamination when immune responses are short. Impaired foraging in infected workers can favour colony resilience when pathogen transmission rate is low (by reducing contacts with the few infected foragers) or trigger colony collapse when transmission rate is fast (by depleting the entire pool of foragers). Our theoretical examination of dietary collective medication in social insects suggests a new possible mechanism by which colonies can defend themselves against pathogens and provides a conceptual framework for experimental investigations of the nutritional immunology of social animals.', 'Animals often alter their food choices following a pathogen infection in order to increase immune function and combat the infection. Whether social animals that collect food for their brood or nestmates adjust their nutrient intake to the infection states of their social partners is virtually unexplored. Here we develop an individual-based model of nutritional geometry to examine the impact of collective nutrient balancing on pathogen spread in a social insect colony. The model simulates a hypothetical social insect colony infected by a horizontally transmitted parasite. Simulation experiments suggest that collective nutrition, by which foragers adjust their nutrient intake to simultaneously address their own nutritional needs as well as those of their infected nestmates, is an efficient social immunity mechanism to limit contamination when immune responses are short. Impaired foraging in infected workers can favour colony resilience when pathogen transmission rate is low (by reducing contacts with the few infected foragers) or trigger colony collapse when transmission rate is fast (by depleting the entire pool of foragers). Our theoretical examination of dietary collective medication in social insects suggests a new possible mechanism by which colonies can defend themselves against pathogens and provides a conceptual framework for experimental investigations of the nutritional immunology of social animals.']"
700_pregnancy_hypospadias_glucose_discourses,0.0043966345874823865,700,4,"['pregnancy', 'hypospadias', 'glucose', 'discourses', 'choosing', 'boys', 'offspring', 'unnecessarily', '1hour', 'overweight']","['Overweight and obesity pre pregnancy or during pregnancy is associated with an increased risk for maternal obstetric and fetal complications. Diet is one modifiable risk factor that women may be motivated to improve. General healthy eating guidelines, micronutrient sufficiency and macronutrient quantity and quality are important nutrition considerations pre and during pregnancy. With regards to specific nutrients, health authorities have recommendations for folate and/or iodine supplementation; but not consistently for iron and omega-3 despite evidence for their association with health outcomes. There are modest additional requirements for energy and protein, but not fat or carbohydrate, in mid-late pregnancy. Diet indices and dietary pattern analysis are additional tools or methodologies used to assess diet quality. These tools have been used to determine dietary intakes and patterns and their association with pregnancy complications and birth outcomes pre or during pregnancy. Women who may unnecessarily resist foods due to fear of food contamination from listeriosis and methylmercury may limit their diet quality and a balanced approached is required. Dietary intake may also vary according to certain population characteristics. Additional support for women who are younger, less educated, overweight and obese, from socially disadvantaged areas, smokers and those who unnecessarily avoid healthy foods, is required to achieve a higher quality diet and optimal lifestyle peri conception.', 'The etiology of hypospadias is poorly understood. Exposure to pesticides has been considered a risk factor, although findings are inconsistent. Diet constitutes a significant exposure route for pesticides, and pesticide residues are more frequently reported in conventional than organic food products. We examined the association between organic dietary choice during pregnancy and presence of hypospadias in the offspring.\nMothers of 306 boys operated on for hypospadias were frequency matched for geography and child birth year to 306 mothers of healthy boys in a case-control study. Telephone interviews were conducted regarding demographic and lifestyle factors, including intake and organic choice of selected food items (milk, dairy products, egg, fruit, vegetables and meat). Logistic regression models were constructed for dietary variables, and odds ratios were calculated controlling for maternal age, body mass index and alcohol consumption.\nOverall organic choice of food items during pregnancy was not associated with hypospadias in the offspring. However, frequent current consumption of high fat dairy products (milk, butter) while rarely or never choosing the organic alternative to these products during pregnancy was associated with increased odds of hypospadias (adjusted OR 2.18, 95% CI 1.09-4.36).\nThis large case-control study of boys operated on for hypospadias suggests an association between hypospadias in the offspring and the mother not choosing the organic alternative, and having a high current intake of nonorganic butter and cheese. This finding could be due to chemical contamination of high fat dairy products. However, general lifestyle and health behavior related to choosing organic alternatives may also explain the finding.', 'The aim of this study was to describe the dietary patterns of pregnant women in northern Puerto Rico and explore associations between diet factors with pregnancy related measurements. This analysis is based on the Puerto Rico Testsite for Exploring Contamination Threats (PROTECT), a prospective cohort that is studying environmental risk factors for preterm births in PR. Participants completed a food frequency questionnaire (FFQ) around 20-28 weeks of gestation. The following pregnancy related measures were collected from the medical records: hemoglobin, blood glucose, blood pressure and gestational age. Potential associations between diet factors and pregnancy measures were assessed using chi square analysis with SPSS. A total of 180 participants completed the FFQ; low hemoglobin levels was found in 19.2%, high blood glucose levels was found in 21.1% by fasting blood glucose test and 24.6%by 1-hour 50 g oral glucose screening test, high blood pressure was found in 2.9% (systolic) and 6.5% (diastolic), and pre-term birth was found in 10.4% of the participants. High consumption of rice, desserts and sweets was associated with higher levels of fasting blood glucose levels (p < 0.05), while high consumption of vegetables was associated with higher 1-hour glucose challenge test (p < 0.05).No other significant associations were found. In conclusion, consumption of high dense energy food diets in pregnancy, such as rice, sweets and desserts, can lead to high levels of blood glucose and can be a potential predictor of other pregnancy complications during pregnancy in these study participants, such as gestational diabetes.']"
924_microscopically_bioinformaticsenabled_librarybased_strainlevel,0.00828741930164745,924,3,"['microscopically', 'bioinformaticsenabled', 'librarybased', 'strainlevel', 'methylobacterium', 'microdissection', 'directcaptured', 'resolution', 'tof', 'maldi']","['Since the advent of the use of matrix-assisted laser desorption/ionization (MALDI) time-of-flight mass spectrometry (TOF MS) as a tool for microbial characterization, efforts to increase the taxonomic resolution of the approach have been made. The rapidity and efficacy of the approach have suggested applications in counter-bioterrorism, prevention of food contamination, and monitoring the spread of antibiotic-resistant bacteria. Strain-level resolution has been reported with diverse bacteria, using library-based and bioinformatics-enabled approaches. Three types of characterization at the strain level have been reported: strain categorization, strain differentiation, and strain identification. Efforts to enhance the library-based approach have involved sample pre-treatment and data reduction strategies. Bioinformatics approaches have leveraged the ever-increasing amount of publicly available genomic and proteomic data to attain strain-level characterization. Bioinformatics-enabled strategies have facilitated strain characterization via intact biomarker identification, bottom-up, and top-down approaches. Rigorous quantitative and advanced statistical analyses have fostered success at the strain level with both approaches. Library-based approaches can be limited by effects of sample preparation and culture conditions on reproducibility, whereas bioinformatics-enabled approaches are typically limited to bacteria, for which genetic and/or proteomic data are available. Biological molecules other than proteins produced in strain-specific manners, including lipids and lipopeptides, might represent other avenues by which strain-level resolution might be attained. Immunological and lectin-based chemistries have shown promise to enhance sensitivity and specificity. Whereas the limits of the taxonomic resolution of MALDI TOF MS profiling of bacteria appears bacterium-specific, recent data suggest that these limits might not yet have been reached.', 'Identification of unwanted microbial contaminants microscopically observed in food products is challenging due to their low abundance in a complex matrix, quite often containing other microorganisms. Therefore, a selective identification method was developed using laser capture microdissection in combination with direct-captured cell PCR. This procedure was validated with Geobacillus stearothermophilus and further used to identify microbial contaminants present in some industrial milk samples. The microscopically observed contaminants were identified as mainly Methylobacterium species.', 'Identification of unwanted microbial contaminants microscopically observed in food products is challenging due to their low abundance in a complex matrix, quite often containing other microorganisms. Therefore, a selective identification method was developed using laser capture microdissection in combination with direct-captured cell PCR. This procedure was validated with Geobacillus stearothermophilus and further used to identify microbial contaminants present in some industrial milk samples. The microscopically observed contaminants were identified as mainly Methylobacterium species.']"
678_pgamended_peppers_ferralsols_moderately,0.005038347444040164,678,4,"['pgamended', 'peppers', 'ferralsols', 'moderately', 'pb', 'grown', 'dim', 'zn', 'cr', 'cambisols']","['Lead (Pb) contamination of soil poses severe health risks to humans through vegetable consumption. The variations of Pb concentration in different parts of rootstalk vegetables (radish, carrot and potato) were investigated by using twelve cultivars grown in acidic Ferralsols and neutral Cambisols under two Pb treatments (125 mg kg(-1) and 250 mg kg(-1) for Ferralsols; 150 mg kg(-1) and 300 mg kg(-1) for Cambisols) in a pot experiment. The Pb concentration in edible parts was higher in Ferralsols under two Pb treatments, with range from 0.28 to 4.14, 0.42-10.66 mg kg(-1) (fresh weight) respectively, and all of them exceeded the food safety standard (0.1 mg kg(-1)) recommended by the Codex Alimentarius Commission of FAO and WHO. The Pb concentration in edible parts was significantly affected by genotype, soil type and the interaction between these two factors. The variation of Pb concentration in different cultivars was partially governed by Pb absorption and the transfer of Pb from aerial to edible part. The results revealed that caution should be paid to the cultivation of rootstalk vegetables in Pb-contaminated Ferralsols without any agronomic management to reduce Pb availability and plant uptake. For Cambisols with slight to moderate Pb contamination, growing potato cultivar Shandong No.1 and Chongqing No.1 was effective in reducing the risk of Pb entering human food chain. The results suggest the possibility of developing cultivar- and soil-specific planting and monitoring guidelines for the cultivation of rootstalk vegetables on slight to moderate Pb-contaminated soils.', 'Phosphogypsum (PG) is a waste produced by the phosphate fertilizer industry that has relatively high concentrations of some heavy metals (e.g., Cd, Cr, Cu, Pb, V, and Zn). The present study was conducted to investigate heavy metal contamination in soils and vegetables (tomatoes and green peppers) and to evaluate the possible health risks associated with the consumption of vegetables grown in PG-amended soils. The enrichment factor values indicated that Pb, Cr, Cu, Ni, Zn, and V were depleted to minimally enriched, and Cd was moderately enriched. The pollution load index values indicated that the PG-amended soils were strongly polluted with Cd, moderately polluted with Cr and Ni, and slightly polluted with Pb, Cu, Zn and V. The geo-accumulation index values indicated that the PG-amended soils were uncontaminated with Pb, Cr, Cu, Ni, Zn, V, and moderately contaminated with Cd. The trace metal transfer for Cd, Cr, Pb, and Zn concentrations was below what are considered as acceptable limits (<1) for food production in soil and vegetables (tomatoes and green peppers) at each site area. Soil-to-plant transfer factor values decreased in order of Zn > Pb > Cd > Cr. The biological absorption coefficients in plants are, in order of highest to lowest, Pb > Zn > Cd > Cr, which suggests that Pb is more bioavailable to plants than Cd, Cr, and Zn. Furthermore, this study highlights that both adults and children consuming vegetables (e.g., tomatoes and green peppers) grown in PG-amended soils ingest significant amounts of the metals studied. However, the daily intake of metals (DIM) and the health risk index (HRI) values are <1, indicating a relative absence of health risks associated with the consumption of vegetables/fruits grown in PG-amended soils. However, while DIM and HRI values suggest that the consumption of plants grown in PG-amended soils is nearly free of risks, there are other sources of metal exposures such as dust inhalation, dermal contact, and ingestion (for children) of metal-contaminated soils, which were not included in this study.', 'Phosphogypsum (PG) is a waste produced by the phosphate fertilizer industry that has relatively high concentrations of some heavy metals (e.g., Cd, Cr, Cu, Pb, V, and Zn). The present study was conducted to investigate heavy metal contamination in soils and vegetables (tomatoes and green peppers) and to evaluate the possible health risks associated with the consumption of vegetables grown in PG-amended soils. The enrichment factor values indicated that Pb, Cr, Cu, Ni, Zn, and V were depleted to minimally enriched, and Cd was moderately enriched. The pollution load index values indicated that the PG-amended soils were strongly polluted with Cd, moderately polluted with Cr and Ni, and slightly polluted with Pb, Cu, Zn and V. The geo-accumulation index values indicated that the PG-amended soils were uncontaminated with Pb, Cr, Cu, Ni, Zn, V, and moderately contaminated with Cd. The trace metal transfer for Cd, Cr, Pb, and Zn concentrations was below what are considered as acceptable limits (<1) for food production in soil and vegetables (tomatoes and green peppers) at each site area. Soil-to-plant transfer factor values decreased in order of Zn > Pb > Cd > Cr. The biological absorption coefficients in plants are, in order of highest to lowest, Pb > Zn > Cd > Cr, which suggests that Pb is more bioavailable to plants than Cd, Cr, and Zn. Furthermore, this study highlights that both adults and children consuming vegetables (e.g., tomatoes and green peppers) grown in PG-amended soils ingest significant amounts of the metals studied. However, the daily intake of metals (DIM) and the health risk index (HRI) values are <1, indicating a relative absence of health risks associated with the consumption of vegetables/fruits grown in PG-amended soils. However, while DIM and HRI values suggest that the consumption of plants grown in PG-amended soils is nearly free of risks, there are other sources of metal exposures such as dust inhalation, dermal contact, and ingestion (for children) of metal-contaminated soils, which were not included in this study.']"
482_afb1_aflatoxin_indonesia_cancer,0.004122843785995711,482,6,"['afb1', 'aflatoxin', 'indonesia', 'cancer', 'ngkg', '0016', 'malaysia', 'moe', 'bw', 'woman']","['This mini review article described the exposure of aflatoxin in Malaysia, including its presence in the foodstuffs and the detection of aflatoxin biomarkers in human biological samples. Historically, the exposure of aflatoxin in Malaysia can be dated in 1960s where an outbreak of disease in pig farms caused severe liver damage to the animals. Later, an aflatoxicosis case in Perak in 1988 was reported and caused death to 13 children, as up to 3 mg of aflatoxin was present in a single serving of contaminated noodles. Since then, extensive research on aflatoxin has been conducted in Malaysia. The food commodities such as peanuts, cereals, spices, and their products are the main commodities commonly found to be contaminated with aflatoxin. Surprisingly, some of the contaminated foods had levels greater than the permissible limit adopted by the Malaysian Food Regulation 1985. Besides, exposure assessment through the measurement of aflatoxin biomarkers in human biological samples is still in its infancy stage. Nevertheless, some studies had reported the presence of these biomarkers. In fact, it is postulated that Malaysians are moderately exposed to aflatoxin compared to those high risk populations, where aflatoxin contamination in the diets is prevalent. Since the ingestion of aflatoxin could be the integral to the development of liver cancer, the incidence of cancer attributable by dietary aflatoxin exposure in Malaysia has also been reported and published in the literatures. Regardless of these findings, the more important task is to monitor and control humans from being exposed to aflatoxin. The enforcement of law is insufficient to minimize human exposure to aflatoxin. Preventive strategies include agricultural, dietary, and clinical measures should be implemented. With the current research on aflatoxin in Malaysia, a global networking for research collaboration is needed to expand the knowledge and disseminate the information to the global scientific community.', 'A high performance liquid chromatographic method was developed for determination of aflatoxin B1 (AFB1) in foods using a monolithic column with sample clean up on an immunoaffinity column. The method was validated for analysis of AFB1 in rice, bread, puffed corn snack, wheat flour and peanut samples. The average recoveries for AFB1 in different foods ranged from 94.4 to 102.5% with the coefficient of variation lower than 10% for all foods. Limit of detection was 0.01 ng/g. A survey of AFB1 was performed on 90 samples collected from Tehran retail market in June 2005. The results showed that none of the bread and wheat flour samples were contaminated with AFB1. The mean AFB1 levels in rice, puffed corn snack and peanut samples were 4.17, 0.11, and 1.97 ng/g, respectively. The level of contamination of 3 samples (one rice sample and two peanuts samples) to AFB1 was found to be higher than 5 ng/g. Although all food samples had mean concentration of AFB1 below the maximum tolerated level in Iran, the mean intake of AFB1 from rice was estimated 3.49 times higher than the guidance value of 1 ng AFB1/Kg body weight/day. Therefore, it is strongly recommended to monitor AFB1 in foods, especially in rice, in Iran. This is the first study on exposure assessment of Iranian population to AFB1.', 'Aflatoxin B1 (AfB1) is a secondary fungal metabolite product widely found in many foodstuffs and considered a public health concern worldwide due to its genotoxicity and carcinogenicity. Tropical climate and inappropriate food safety practices in Indonesia are the favorable conditions for AfB1 contamination of foodstuffs. Despite these challenges, there has been a limited number of risk assessment of AfB1 conducted in Indonesia. Therefore, this paper aimed to gather all available occurrence data of AfB1 in maize and peanut originating from Indonesia and used the occurrence data to evaluate the risk of exposure to AfB1 using the Margin of Exposure (MOE) and the quantitative liver cancer risk approaches established by EFSA and FAO/WHO respectively. Risk assessment using both the MOE and quantitative liver cancer risk approaches revealed that AfB1 exposure from maize and peanut consumption in Indonesia is of concern. The MOE values derived from consumption of maize and peanut originating from Indonesia were generally below 10,000, and for several occurrence data were even below 1000. The estimated number of liver cancer cases associated with AfB1 exposure generally was above the 0.1 cancer cases/100,000 individuals/75 years. Altogether the evaluation reveals the urgency for risk management of AfB1 in Indonesia.']"
