Name,dov,Topic,Count,Representation,Representative_Docs
826_micelles_ttcp_controllable_thymol,0.0045180722891566254,826,3,"['micelles', 'ttcp', 'controllable', 'thymol', 'cpms', 'rosinducing', 'payloads', 'exterior', 'waterinsoluble', 'formulation']","['Contamination of surfaces in hospitals and food industry by bacterial biofilms is a serious health risk. Of concern is their resistance to routine antibacterials and disinfectants. This requires the development of novel approaches to biofilm detachment. The study evaluates the effectiveness of cationic polymer micelles (CPMs) against pre-formed biofilms. CPMs based on different polycations were used. The hydrodynamic radius of the particles ranged from 16 to 360 nm. Biofilms of ', 'Bacterial biofilms are widely associated with persistent infections and food contamination. High resistance to conventional antimicrobial agents resulted in an urgent need for novel formulation to eliminate these bacterial communities. Herein we fabricated light controllable chitosan micelles loading with thymol (T-TCP) for elimination of biofilm. Due to the exterior chitosan, T-TCP micelles easily bind to negative biofilm through electrostatic interaction and efficiently deliver the essential oil payloads. Under irradiation, T-TCP micelles generated ROS, which triggered simultaneous thymol release and also resulted in additional ROS-inducing bactericidal effects, both effectively eradicating biofilms of Listeria monocytogenes and Staphylococcus aureus. This formulation provided a platform for other water-insoluble antimicrobials and might be used as a potent and controllable solution to biofilm fighting.', 'Bacterial biofilms are widely associated with persistent infections and food contamination. High resistance to conventional antimicrobial agents resulted in an urgent need for novel formulation to eliminate these bacterial communities. Herein we fabricated light controllable chitosan micelles loading with thymol (T-TCP) for elimination of biofilm. Due to the exterior chitosan, T-TCP micelles easily bind to negative biofilm through electrostatic interaction and efficiently deliver the essential oil payloads. Under irradiation, T-TCP micelles generated ROS, which triggered simultaneous thymol release and also resulted in additional ROS-inducing bactericidal effects, both effectively eradicating biofilms of Listeria monocytogenes and Staphylococcus aureus. This formulation provided a platform for other water-insoluble antimicrobials and might be used as a potent and controllable solution to biofilm fighting.']"
515_nickel_drinks_bioaccessibility_plantbased,0.0050251256281407045,515,5,"['nickel', 'drinks', 'bioaccessibility', 'plantbased', 'overestimation', 'bioavailability', 'animalbased', 'bioaccessibilitybioavailability', 'legumes', 'epithelium']","['Nickel can occur in plant-based, animal-based foods and drinks. It can either naturally occur in plants or it could originate from contamination. The natural occurrence of nickel arises from the fact that the element plays an essential role in the functioning of enzymes involved in the nitrogen fixation process. Besides, contamination can occur at any stage of the production, processing or packing of the foods. More specifically, nickel can leach from contact materials to foods or drinks before their consumption by humans. In recent years, the European Food Safety Authority expressed concern regarding the chronic and acute exposure of the European population to nickel. This study aimed to screen foods available on the Belgian market for their nickel content and to identify potential sources of the contamination. In total, 708 samples were collected from three different main categories of foods, including plant-based products, animal-based products and drinks. Elevated nickel concentrations were found in plant-based products such as chocolate, legumes, nuts, figs, peanut butter, chocolate spreads and breakfast cereals. The nickel concentrations in the animal-based products and drinks were significantly lower compared to the plant-based products. In the beer samples, no correlation between the alcohol percentage and nickel concentration was found. Higher nickel concentrations were found in the tea drinks in comparison to other drinks. Furthermore, the effect of packaging, e.g. storage in cans, on the final nickel concentration of the foods was investigated. No effect of the packaging was found, demonstrating that leaching of nickel from packaging materials is not significantly contributing to the nickel content in foods. The results demonstrate high concentrations of nickel in some plant-based food products and further exposure assessment studies are needed to evaluate the risk due to intake of nickel-enriched food products.', 'The metal nickel is well known to cause nickel allergy in sensitive humans by prolonged dermal contact to materials releasing (high) amounts of nickel. Oral nickel exposure via water and food intake is of potential concern. Nickel is essential to plants and animals and can be naturally found in food products or contamination may occur across the agro-food chain. This gap analysis is an evaluation of nickel as a potential food safety hazard causing a risk for human health. In the first step, the available data regarding the occurrence of nickel and its contamination in food and drinks have been collected through literature review. Subsequently, a discussion is held on the potential risks associated with this contamination. Elevated nickel concentrations were mostly found in plant-based foods, e.g. legumes and nuts in which nickel of natural origin is expected. However, it was observed that dedicated and systematic screening of foodstuffs for the presence of nickel is currently still lacking. In a next step, published studies on exposure of humans to nickel via foods and drinks were critically evaluated. Not including bioaccessibility and/or bioavailability of the metal may lead to an overestimation of the exposure of the body to nickel via food and drinks. This overestimation may be problematic when the measured nickel level in foods is high and bioaccessibility and/or bioavailability of nickel in these products is low. Therefore, this paper analyzes the outcomes of the existing dietary intake and bioaccessibility/bioavailability studies conducted for nickel. Besides, the available gaps in nickel bioaccessibility and/or bioavailability studies have been clarified in this paper. The reported bioaccessibility and bioavailability percentages for different food and drinks were found to vary between <LOD and 83% and between 0 and 30% respectively. This indicates that of the total nickel contained in the foodstuffs only a fraction can be absorbed by the intestinal epithelium cells. This paper provides a unique critical overview on nickel in the human diet starting from factors affecting its occurrence in food until its absorption by the body.', 'The metal nickel is well known to cause nickel allergy in sensitive humans by prolonged dermal contact to materials releasing (high) amounts of nickel. Oral nickel exposure via water and food intake is of potential concern. Nickel is essential to plants and animals and can be naturally found in food products or contamination may occur across the agro-food chain. This gap analysis is an evaluation of nickel as a potential food safety hazard causing a risk for human health. In the first step, the available data regarding the occurrence of nickel and its contamination in food and drinks have been collected through literature review. Subsequently, a discussion is held on the potential risks associated with this contamination. Elevated nickel concentrations were mostly found in plant-based foods, e.g. legumes and nuts in which nickel of natural origin is expected. However, it was observed that dedicated and systematic screening of foodstuffs for the presence of nickel is currently still lacking. In a next step, published studies on exposure of humans to nickel via foods and drinks were critically evaluated. Not including bioaccessibility and/or bioavailability of the metal may lead to an overestimation of the exposure of the body to nickel via food and drinks. This overestimation may be problematic when the measured nickel level in foods is high and bioaccessibility and/or bioavailability of nickel in these products is low. Therefore, this paper analyzes the outcomes of the existing dietary intake and bioaccessibility/bioavailability studies conducted for nickel. Besides, the available gaps in nickel bioaccessibility and/or bioavailability studies have been clarified in this paper. The reported bioaccessibility and bioavailability percentages for different food and drinks were found to vary between <LOD and 83% and between 0 and 30% respectively. This indicates that of the total nickel contained in the foodstuffs only a fraction can be absorbed by the intestinal epithelium cells. This paper provides a unique critical overview on nickel in the human diet starting from factors affecting its occurrence in food until its absorption by the body.']"
513_streptomyces_surplus_consortia_ben,0.0050251256281407045,513,5,"['streptomyces', 'surplus', 'consortia', 'ben', 'gattii', 'fluconazole', 'chitinases', 'benadapted', 'crossresistance', 'gcms']","['The increasing human population requires ongoing efforts in food production. This is frequently associated with an increased use of agrochemicals, leading to environmental contamination and altering microbial communities, including human fungal pathogens that reside in the environment. Cryptococcus gattii is an environmental yeast and is one of the etiological agents of cryptococcosis. Benomyl (BEN) is a broad-spectrum fungicide used on several crops. To study the effects of agrochemicals on fungal pathogens, we first evaluated the susceptibility of C. gattii to BEN and the interactions with clinical antifungals. Antagonistic interaction between BEN and fluconazole was seen and was strain- and concentration-dependent. We then induced BEN-resistance by culturing strains in increasing drug concentrations. One strain demonstrated to be more resistant and showed increased multidrug efflux pump gene (MDR1) expression and increased rhodamine 6G efflux, leading to cross-resistance between BEN and fluconazole. Morphologically, BEN-adapted cells had a reduced polysaccharide capsule; an increased surface/volume ratio; increased growth rate in vitro and inside macrophages and also higher ability in crossing an in vitro model of blood-brain-barrier. BEN-adapted strain demonstrated to be hypervirulent in mice, leading to severe symptoms of cryptococcosis, early mortality and higher fungal burden in the organs, particularly the brain. The parental strain was avirulent in murine model. In vivo cross-resistance between BEN and fluconazole was observed, with mice infected with the adapted strain unable to present any improvement in survival and behavior when treated with this antifungal. Furthermore, BEN-adapted cells cultured in drug-free media maintained the hypervirulent and cross-resistant phenotype, suggesting a persistent effect of BEN on C. gattii. In conclusion, exposure to BEN induces cross-resistance with fluconazole and increases the virulence of C. gattii. Altogether, our results indicate that agrochemicals may lead to unintended consequences on non-target species and this could result in severe healthy problems worldwide.', 'Consortia of Streptomyces spp. (colonies 169, 194, 165 and 130) used in this study are an efficient producer of secondary metabolites like chitinases and antifungal compounds, which may help in the protection of surplus food from spoilage. Qualitative screening for chitinase production and taxonomy of these colonies were undertaken in our previous studies. In the current study, GC-MS analysis of extract produced from the consortia of Streptomyces strains was done for the identification of antifungal compounds. Treatment of surplus food with activated consortia of Streptomyces spp. has protected powdered food for a month, whereas fresh food (unpowdered) was preserved for two days. A control sample of surplus food (untreated) was kept to check the contamination, which resulted in the growth of three fungi (FP-1, FG-1, and FB-1). Taxonomic characterization of fungi and identification of toxic compounds produced from them were done by ITS amplification and GC-MS analysis, respectively. The study shows that the secondary metabolites from Streptomyces spp. have the potential to protect the food from mycotoxin contamination. Based on literature reports, this is for the first time that bioactive compounds and chitinases produced from Streptomyces are being used for the protection and management of surplus food.', 'Consortia of Streptomyces spp. (colonies 169, 194, 165 and 130) used in this study are an efficient producer of secondary metabolites like chitinases and antifungal compounds, which may help in the protection of surplus food from spoilage. Qualitative screening for chitinase production and taxonomy of these colonies were undertaken in our previous studies. In the current study, GC-MS analysis of extract produced from the consortia of Streptomyces strains was done for the identification of antifungal compounds. Treatment of surplus food with activated consortia of Streptomyces spp. has protected powdered food for a month, whereas fresh food (unpowdered) was preserved for two days. A control sample of surplus food (untreated) was kept to check the contamination, which resulted in the growth of three fungi (FP-1, FG-1, and FB-1). Taxonomic characterization of fungi and identification of toxic compounds produced from them were done by ITS amplification and GC-MS analysis, respectively. The study shows that the secondary metabolites from Streptomyces spp. have the potential to protect the food from mycotoxin contamination. Based on literature reports, this is for the first time that bioactive compounds and chitinases produced from Streptomyces are being used for the protection and management of surplus food.']"
723_mc_pf_cellg_concentrationbased,0.004020100502512563,723,4,"['mc', 'pf', 'cellg', 'concentrationbased', 'ceftiofur', 'lots', 'heidelberg', 'ceftiofurresistant', 'turkey', 'scenarios']","[""Salmonella Heidelberg resistant to ceftiofur (a third-generation cephalosporin antimicrobial agent) in broiler chicken products pose a risk to public health in Canada. The objective of this study was to assess the extent of that risk and to evaluate the effect of intervention measures along the agri-food chain. A stochastic farm-to-fork quantitative microbial risk assessment model was developed following the Codex Alimentarius Guidelines for Risk Analysis of Foodborne Antimicrobial Resistance. Different scenarios were analyzed to assess the individual relative effects of 18 possible interventions in comparison to a baseline scenario. The baseline scenario represented the first year of on-farm antimicrobial use surveillance in the Canadian broiler industry and the year before an industry-imposed ban on the preventive use of antimicrobials of very high importance to human health (2013), where 31.3% of broiler flocks consisted of birds to which ceftiofur was administered. The baseline scenario predicted an average probability of illness of 1.1 per 100,000 servings (SE: 0.064 per 100,000), corresponding to an average of 22,000 human infections (SE: 1900) with ceftiofur-resistant S. Heidelberg per year, which is likely an overestimation. This risk was reduced by 90% or 20% when two separate scenarios designed to capture the effect of withdrawing preventive ceftiofur use from poultry production were simulated using different approaches; data used for the former scenario were confounded by other potential concomitant control measures (e.g. Salmonella vaccination programme), so the true effect likely lies somewhere between the two estimates. A theoretical 'worst case' scenario where all flocks had birds exposed to ceftiofur increased the risk by 107%. A 50% reduction in the probability of human prior exposure to antimicrobials, which has a selective and competitive effect for Salmonella spp. following ingestion of contaminated products, reduced the risk by 65%. Other promising measures that could be considered for further risk management included improved cleaning and disinfection between broiler flocks on farm (risk reduction by 26%), exclusive use of air chilling (risk reduction by 34%), and the improvement of meat storage and preparation conditions, e.g., no temperature abuse at retail (risk reduction by 88%). These findings showed the importance of a structured approach to assessing and potentially implementing effective interventions to reduce the risk associated with ceftiofur-resistant S. Heidelberg at different steps along the agri-food chain. Major data gaps included information on concentrations of resistant bacteria, cross contamination at processing and how ceftiofur-resistant S. Heidelberg behave in comparison with susceptible ones, e.g., in terms of growth and survival ability, as well as pathogenicity and virulence."", ""Despite initiatives to improve the safety of poultry products in the United States, progress has stalled, and salmonellosis incidence is still above Healthy People 2020's goal. One strategy to manage Salmonella and verify process control in poultry establishments is to implement microbiological criteria (MC) linked to public health outcomes. Concentration-based MC have been used by the food industry; however, the public health impact of such approaches is only starting to be assessed. This study evaluated the public health impact of a concentration-based MC for Salmonella in raw ground turkey consumed in the United States using a quantitative risk assessment modeling approach. The distribution of Salmonella concentration in ground turkey was derived from USDA-FSIS monitoring surveys. Other variables and parameters were derived from public databases, literature, and expert opinion. Based on considered concentrations, implementing a MC of 1 cell/g led to an estimated 46.1% reduction (preventable fraction, PF) in the mean probability of illness when consumer cooking and cross-contamination were included. The PF was consistent across scenarios including or excluding cross-contamination and cooking, with slightly lower mean PF when cross-contamination was included. The proportion of lots not compliant with the 1 cell/g MC was 1.05% in the main scenarios and increased nonlinearly when higher Salmonella concentrations were assumed. Assumptions on concentration variability across lots and within lots had a large impact, highlighting the benefit of reducing this uncertainty. These approach and results can help inform the development of MC to monitor and control Salmonella in ground turkey products."", ""Despite initiatives to improve the safety of poultry products in the United States, progress has stalled, and salmonellosis incidence is still above Healthy People 2020's goal. One strategy to manage Salmonella and verify process control in poultry establishments is to implement microbiological criteria (MC) linked to public health outcomes. Concentration-based MC have been used by the food industry; however, the public health impact of such approaches is only starting to be assessed. This study evaluated the public health impact of a concentration-based MC for Salmonella in raw ground turkey consumed in the United States using a quantitative risk assessment modeling approach. The distribution of Salmonella concentration in ground turkey was derived from USDA-FSIS monitoring surveys. Other variables and parameters were derived from public databases, literature, and expert opinion. Based on considered concentrations, implementing a MC of 1 cell/g led to an estimated 46.1% reduction (preventable fraction, PF) in the mean probability of illness when consumer cooking and cross-contamination were included. The PF was consistent across scenarios including or excluding cross-contamination and cooking, with slightly lower mean PF when cross-contamination was included. The proportion of lots not compliant with the 1 cell/g MC was 1.05% in the main scenarios and increased nonlinearly when higher Salmonella concentrations were assumed. Assumptions on concentration variability across lots and within lots had a large impact, highlighting the benefit of reducing this uncertainty. These approach and results can help inform the development of MC to monitor and control Salmonella in ground turkey products.""]"
425_ndma_ranitidine_nitrosamine_medications,0.004339871877408953,425,6,"['ndma', 'ranitidine', 'nitrosamine', 'medications', 'impurities', 'arbs', 'safetybased', 'angiotensin', 'valsartan', 'nnitrosamine']","['Nitrosamines are known carcinogens which have been recently discovered in several angiotensin receptor blockers (ARBs). This led to the recall of valsartan in the United States in 2018, and afterward, the recall of other ARBs as well as unrelated medications (e.g., ranitidine). The presence of nitrosamine in ARBs was likely a result of changes in the manufacturing process, although nitrosamine contamination is believed to occur by different mechanisms with other medications. The United States Food and Drug Administration has since taken steps to identify products affected by nitrosamine contamination and mitigate this concern going forward. Despite the contamination of some drug products, studies estimate that the overall risk to patients is low enough to not necessitate changes in prescribing patterns at this time.', 'Ranitidine is a medication that has been used to alleviate heartburn and other disorders for over 40 years. Following reports of N-nitrosodimethylamine (NDMA) contamination in ranitidine products, there have been many recalls and registration suspensions. Here, we revise the literature information confirming ranitidine association with NDMA. Then, we highlight the documented mechanisms for NDMA release from ranitidine. In addition, the stability issue for this medicine is discussed. After that, we review and discuss the results of the United States Food and Drug Administration and the Australian Therapeutic Goods Administration laboratory testing of ranitidine products and the detected NDMA levels. Finally, the case of NDMA generation in Angiotensin II Receptor Blockers (ARBs) and ranitidine were compared in an attempt to address the circumstances leading to the current contamination.', ""NDMA is a semivolatile organic chemical classified as a probable carcinogen by the International Agency for Research on Cancer. NDMA exposure to humans is potentially vast, with reports of it occurring in tobacco products, food, water, interior air of cars, toiletries, and a variety of other household goods. Public attention has recently focused on NDMA contamination because it has been implicated in the recall of several medications, including valsartan, losartan, irbesartan, and, most recently, the removal of ranitidine from the market. Its potential for elevated risk of cancer has sparked concern in the health care community. Pharmacists are uniquely situated to process and use this complex information because of their extensive pharmacokinetic and pharmacodynamic knowledge of medications, direct and regular contact with patients, insights and familiarity with recalls, and ability to discuss alternative medications that may alleviate a patient's concerns. It is important to communicate the context and clinical relevance of NDMA contamination to both patients and fellow health care clinicians. Pharmacists can help balance the potential adverse effects of switching medication and the concern related to NDMA in making an informed health decision.""]"
